

================================================================
== Vitis HLS Report for 'top_kernel_Pipeline_VITIS_LOOP_20_1_VITIS_LOOP_21_2'
================================================================
* Date:           Sun Feb  1 18:45:34 2026

* Version:        2025.1.1 (Build 6214317 on Sep 11 2025)
* Project:        project_1
* Solution:       hls (Vivado IP Flow Target)
* Product family: zynquplus
* Target device:  xczu3eg-sbva484-1-e


================================================================
== Performance Estimates
================================================================
+ Timing: 
    * Summary: 
    +--------+----------+----------+------------+
    |  Clock |  Target  | Estimated| Uncertainty|
    +--------+----------+----------+------------+
    |ap_clk  |  10.00 ns|  7.300 ns|     2.70 ns|
    +--------+----------+----------+------------+

+ Latency: 
    * Summary: 
    +---------+---------+----------+----------+-------+-------+------------------------------------------------+
    |  Latency (cycles) |  Latency (absolute) |    Interval   |                    Pipeline                    |
    |   min   |   max   |    min   |    max   |  min  |  max  |                      Type                      |
    +---------+---------+----------+----------+-------+-------+------------------------------------------------+
    |    16387|    16387|  0.164 ms|  0.164 ms|  16385|  16385|  loop auto-rewind stp (delay=0 clock cycles(s))|
    +---------+---------+----------+----------+-------+-------+------------------------------------------------+

    + Detail: 
        * Instance: 
        N/A

        * Loop: 
        +-----------------------------------+---------+---------+----------+-----------+-----------+-------+----------+
        |                                   |  Latency (cycles) | Iteration|  Initiation Interval  |  Trip |          |
        |             Loop Name             |   min   |   max   |  Latency |  achieved |   target  | Count | Pipelined|
        +-----------------------------------+---------+---------+----------+-----------+-----------+-------+----------+
        |- VITIS_LOOP_20_1_VITIS_LOOP_21_2  |    16385|    16385|         3|          1|          1|  16384|       yes|
        +-----------------------------------+---------+---------+----------+-----------+-----------+-------+----------+

============================================================
+ Verbose Summary: Synthesis Manager
============================================================
InlineROM: 1
ExposeGlobal: 0
============================================================
+ Verbose Summary: CDFG Model
============================================================
IsTopModel: 0
ResetActiveHigh: 1
IsCombinational: 0
IsDatapathOnly: 0
HasWiredReturn: 1
HasMFsm: 2
HasVarLatency: 1
IsPipeline: 0
IsRtlPipelined: 0
IsInstanceOverlapped: 0
IsDontTouch: 0
HasImplIP: 0
IsGatedGlobalClock: 0

+ Individual pipeline summary: 
  * Pipeline-0: initiation interval (II) = 1, depth = 3


============================================================
+ Verbose Summary: Schedule
============================================================
* Number of FSM states : 3
* Pipeline : 1
  Pipeline-0 : II = 1, D = 3, States = { 1 2 3 }
* Dataflow Pipeline: 0

* FSM state transitions: 
1 --> 2 
2 --> 3 
3 --> 

* FSM state operations: 

State 1 <SV = 0> <Delay = 1.98>
ST_1 : Operation 6 [1/1] (0.00ns)   --->   "%j = alloca i32 1" [top.cpp:21]   --->   Operation 6 'alloca' 'j' <Predicate = true> <Delay = 0.00>
ST_1 : Operation 7 [1/1] (0.00ns)   --->   "%i = alloca i32 1" [top.cpp:20]   --->   Operation 7 'alloca' 'i' <Predicate = true> <Delay = 0.00>
ST_1 : Operation 8 [1/1] (0.00ns)   --->   "%indvar_flatten = alloca i32 1"   --->   Operation 8 'alloca' 'indvar_flatten' <Predicate = true> <Delay = 0.00>
ST_1 : Operation 9 [1/1] (0.00ns)   --->   "%sext_ln20_read = read i62 @_ssdm_op_Read.ap_auto.i62, i62 %sext_ln20"   --->   Operation 9 'read' 'sext_ln20_read' <Predicate = true> <Delay = 0.00>
ST_1 : Operation 10 [1/1] (0.00ns)   --->   "%sext_ln20_cast = sext i62 %sext_ln20_read"   --->   Operation 10 'sext' 'sext_ln20_cast' <Predicate = true> <Delay = 0.00>
ST_1 : Operation 11 [1/1] (0.00ns)   --->   "%specinterface_ln0 = specinterface void @_ssdm_op_SpecInterface, i32 %A, void @empty_0, i32 0, i32 0, void @empty_1, i32 0, i32 0, void @empty_2, void @empty_3, void @empty_1, i32 16, i32 16, i32 16, i32 16, void @empty_1, void @empty_1, i32 4294967295, i32 0, i32 0"   --->   Operation 11 'specinterface' 'specinterface_ln0' <Predicate = true> <Delay = 0.00>
ST_1 : Operation 12 [1/1] (0.48ns)   --->   "%store_ln0 = store i15 0, i15 %indvar_flatten"   --->   Operation 12 'store' 'store_ln0' <Predicate = true> <Delay = 0.48>
ST_1 : Operation 13 [1/1] (0.48ns)   --->   "%store_ln20 = store i9 0, i9 %i" [top.cpp:20]   --->   Operation 13 'store' 'store_ln20' <Predicate = true> <Delay = 0.48>
ST_1 : Operation 14 [1/1] (0.48ns)   --->   "%store_ln21 = store i7 0, i7 %j" [top.cpp:21]   --->   Operation 14 'store' 'store_ln21' <Predicate = true> <Delay = 0.48>
ST_1 : Operation 15 [1/1] (0.00ns)   --->   "%br_ln0 = br void %for.inc"   --->   Operation 15 'br' 'br_ln0' <Predicate = true> <Delay = 0.00>
ST_1 : Operation 16 [1/1] (0.00ns)   --->   "%indvar_flatten_load = load i15 %indvar_flatten" [top.cpp:20]   --->   Operation 16 'load' 'indvar_flatten_load' <Predicate = true> <Delay = 0.00>
ST_1 : Operation 17 [1/1] (0.00ns)   --->   "%specbitsmap_ln0 = specbitsmap void @_ssdm_op_SpecBitsMap, i32 %A"   --->   Operation 17 'specbitsmap' 'specbitsmap_ln0' <Predicate = true> <Delay = 0.00>
ST_1 : Operation 18 [1/1] (1.00ns)   --->   "%icmp_ln20 = icmp_eq  i15 %indvar_flatten_load, i15 16384" [top.cpp:20]   --->   Operation 18 'icmp' 'icmp_ln20' <Predicate = true> <Delay = 1.00> <CoreInst = "Cmp">   --->   Core 9 'Cmp' <Latency = 0> <II = 1> <Delay = 1.00> <FuncUnit> <Opcode : 'seteq' 'setne' 'setle' 'setge' 'setlt' 'setgt'> <InPorts = 2> <OutPorts = 1>
ST_1 : Operation 19 [1/1] (1.00ns)   --->   "%add_ln20_1 = add i15 %indvar_flatten_load, i15 1" [top.cpp:20]   --->   Operation 19 'add' 'add_ln20_1' <Predicate = true> <Delay = 1.00> <CoreInst = "Adder">   --->   Core 1 'Adder' <Latency = 0> <II = 1> <Delay = 1.00> <FuncUnit> <Opcode : 'add' 'sub'> <InPorts = 2> <OutPorts = 1>
ST_1 : Operation 20 [1/1] (0.00ns)   --->   "%br_ln20 = br i1 %icmp_ln20, void %for.inc11, void %VITIS_LOOP_32_4.preheader.exitStub" [top.cpp:20]   --->   Operation 20 'br' 'br_ln20' <Predicate = true> <Delay = 0.00>
ST_1 : Operation 21 [1/1] (0.48ns)   --->   "%store_ln20 = store i15 %add_ln20_1, i15 %indvar_flatten" [top.cpp:20]   --->   Operation 21 'store' 'store_ln20' <Predicate = (!icmp_ln20)> <Delay = 0.48>

State 2 <SV = 1> <Delay = 7.30>
ST_2 : Operation 22 [1/1] (0.00ns)   --->   "%A_addr = getelementptr i32 %A, i64 %sext_ln20_cast" [top.cpp:20]   --->   Operation 22 'getelementptr' 'A_addr' <Predicate = true> <Delay = 0.00>
ST_2 : Operation 23 [1/1] (7.30ns)   --->   "%A_addr_read = read i32 @_ssdm_op_Read.m_axi.p1i32, i32 %A_addr" [top.cpp:23]   --->   Operation 23 'read' 'A_addr_read' <Predicate = true> <Delay = 7.30> <CoreInst = "m_axi">   --->   Core 119 'm_axi' <Latency = 3> <II = 1> <Delay = 1.00> <Adapter> <Opcode : 'read' 'write' 'readreq' 'writereq' 'writeresp'>
ST_2 : Operation 24 [1/1] (0.00ns)   --->   "%trunc_ln23 = trunc i32 %A_addr_read" [top.cpp:23]   --->   Operation 24 'trunc' 'trunc_ln23' <Predicate = true> <Delay = 0.00>
ST_2 : Operation 56 [1/1] (0.48ns)   --->   "%ret_ln0 = ret"   --->   Operation 56 'ret' 'ret_ln0' <Predicate = (icmp_ln20)> <Delay = 0.48>

State 3 <SV = 2> <Delay = 3.29>
ST_3 : Operation 25 [1/1] (0.00ns)   --->   "%j_load = load i7 %j" [top.cpp:21]   --->   Operation 25 'load' 'j_load' <Predicate = true> <Delay = 0.00>
ST_3 : Operation 26 [1/1] (0.00ns)   --->   "%i_load = load i9 %i" [top.cpp:20]   --->   Operation 26 'load' 'i_load' <Predicate = true> <Delay = 0.00>
ST_3 : Operation 27 [1/1] (0.92ns)   --->   "%add_ln20 = add i9 %i_load, i9 1" [top.cpp:20]   --->   Operation 27 'add' 'add_ln20' <Predicate = true> <Delay = 0.92> <CoreInst = "Adder">   --->   Core 1 'Adder' <Latency = 0> <II = 1> <Delay = 0.92> <FuncUnit> <Opcode : 'add' 'sub'> <InPorts = 2> <OutPorts = 1>
ST_3 : Operation 28 [1/1] (0.00ns)   --->   "%specloopname_ln0 = specloopname void @_ssdm_op_SpecLoopName, void @VITIS_LOOP_20_1_VITIS_LOOP_21_2_str"   --->   Operation 28 'specloopname' 'specloopname_ln0' <Predicate = true> <Delay = 0.00>
ST_3 : Operation 29 [1/1] (0.00ns)   --->   "%speclooptripcount_ln0 = speclooptripcount void @_ssdm_op_SpecLoopTripCount, i64 16384, i64 16384, i64 16384"   --->   Operation 29 'speclooptripcount' 'speclooptripcount_ln0' <Predicate = true> <Delay = 0.00>
ST_3 : Operation 30 [1/1] (0.89ns)   --->   "%icmp_ln21 = icmp_eq  i7 %j_load, i7 64" [top.cpp:21]   --->   Operation 30 'icmp' 'icmp_ln21' <Predicate = true> <Delay = 0.89> <CoreInst = "Cmp">   --->   Core 9 'Cmp' <Latency = 0> <II = 1> <Delay = 0.89> <FuncUnit> <Opcode : 'seteq' 'setne' 'setle' 'setge' 'setlt' 'setgt'> <InPorts = 2> <OutPorts = 1>
ST_3 : Operation 31 [1/1] (0.42ns)   --->   "%select_ln20 = select i1 %icmp_ln21, i7 0, i7 %j_load" [top.cpp:20]   --->   Operation 31 'select' 'select_ln20' <Predicate = true> <Delay = 0.42> <CoreInst = "Sel">   --->   Core 73 'Sel' <Latency = 0> <II = 1> <Delay = 0.42> <FuncUnit> <Opcode : 'select'> <InPorts = 3> <OutPorts = 1>
ST_3 : Operation 32 [1/1] (0.45ns)   --->   "%select_ln20_1 = select i1 %icmp_ln21, i9 %add_ln20, i9 %i_load" [top.cpp:20]   --->   Operation 32 'select' 'select_ln20_1' <Predicate = true> <Delay = 0.45> <CoreInst = "Sel">   --->   Core 73 'Sel' <Latency = 0> <II = 1> <Delay = 0.45> <FuncUnit> <Opcode : 'select'> <InPorts = 3> <OutPorts = 1>
ST_3 : Operation 33 [1/1] (0.00ns)   --->   "%trunc_ln21 = trunc i9 %select_ln20_1" [top.cpp:21]   --->   Operation 33 'trunc' 'trunc_ln21' <Predicate = true> <Delay = 0.00>
ST_3 : Operation 34 [1/1] (0.00ns)   --->   "%trunc_ln21_1 = trunc i7 %select_ln20" [top.cpp:21]   --->   Operation 34 'trunc' 'trunc_ln21_1' <Predicate = true> <Delay = 0.00>
ST_3 : Operation 35 [1/1] (0.00ns)   --->   "%specpipeline_ln22 = specpipeline void @_ssdm_op_SpecPipeline, i32 1, i32 0, i32 0, i32 0, void @empty_1" [top.cpp:22]   --->   Operation 35 'specpipeline' 'specpipeline_ln22' <Predicate = true> <Delay = 0.00>
ST_3 : Operation 36 [1/1] (0.00ns)   --->   "%lshr_ln = partselect i4 @_ssdm_op_PartSelect.i4.i7.i32.i32, i7 %select_ln20, i32 2, i32 5" [top.cpp:21]   --->   Operation 36 'partselect' 'lshr_ln' <Predicate = true> <Delay = 0.00>
ST_3 : Operation 37 [1/1] (0.00ns)   --->   "%tmp_149 = bitconcatenate i12 @_ssdm_op_BitConcatenate.i12.i8.i4, i8 %trunc_ln21, i4 %lshr_ln" [top.cpp:23]   --->   Operation 37 'bitconcatenate' 'tmp_149' <Predicate = true> <Delay = 0.00>
ST_3 : Operation 38 [1/1] (0.00ns)   --->   "%zext_ln23 = zext i12 %tmp_149" [top.cpp:23]   --->   Operation 38 'zext' 'zext_ln23' <Predicate = true> <Delay = 0.00>
ST_3 : Operation 39 [1/1] (0.00ns)   --->   "%A_1_addr = getelementptr i24 %A_1, i64 0, i64 %zext_ln23" [top.cpp:23]   --->   Operation 39 'getelementptr' 'A_1_addr' <Predicate = true> <Delay = 0.00>
ST_3 : Operation 40 [1/1] (0.00ns)   --->   "%A_1_addr_45 = getelementptr i24 %A_1_21, i64 0, i64 %zext_ln23" [top.cpp:23]   --->   Operation 40 'getelementptr' 'A_1_addr_45' <Predicate = true> <Delay = 0.00>
ST_3 : Operation 41 [1/1] (0.00ns)   --->   "%A_2_addr = getelementptr i24 %A_2, i64 0, i64 %zext_ln23" [top.cpp:23]   --->   Operation 41 'getelementptr' 'A_2_addr' <Predicate = true> <Delay = 0.00>
ST_3 : Operation 42 [1/1] (0.00ns)   --->   "%A_3_addr = getelementptr i24 %A_3, i64 0, i64 %zext_ln23" [top.cpp:23]   --->   Operation 42 'getelementptr' 'A_3_addr' <Predicate = true> <Delay = 0.00>
ST_3 : Operation 43 [1/1] (0.62ns)   --->   "%switch_ln23 = switch i2 %trunc_ln21_1, void %arrayidx1010.case.3, i2 0, void %arrayidx1010.case.0, i2 1, void %arrayidx1010.case.1, i2 2, void %arrayidx1010.case.2" [top.cpp:23]   --->   Operation 43 'switch' 'switch_ln23' <Predicate = true> <Delay = 0.62>
ST_3 : Operation 44 [1/1] ( I:1.35ns O:1.35ns )   --->   "%store_ln23 = store i24 %trunc_ln23, i12 %A_2_addr" [top.cpp:23]   --->   Operation 44 'store' 'store_ln23' <Predicate = (trunc_ln21_1 == 2)> <Delay = 1.35> <CoreInst = "RAM">   --->   Core 82 'RAM' <Latency = 1> <II = 1> <Delay = 1.35> <Storage> <Opcode : 'load' 'store'> <Ports = 2> <Width = 24> <Depth = 4096> <RAM>
ST_3 : Operation 45 [1/1] (0.00ns)   --->   "%br_ln23 = br void %arrayidx1010.exit" [top.cpp:23]   --->   Operation 45 'br' 'br_ln23' <Predicate = (trunc_ln21_1 == 2)> <Delay = 0.00>
ST_3 : Operation 46 [1/1] ( I:1.35ns O:1.35ns )   --->   "%store_ln23 = store i24 %trunc_ln23, i12 %A_1_addr_45" [top.cpp:23]   --->   Operation 46 'store' 'store_ln23' <Predicate = (trunc_ln21_1 == 1)> <Delay = 1.35> <CoreInst = "RAM">   --->   Core 82 'RAM' <Latency = 1> <II = 1> <Delay = 1.35> <Storage> <Opcode : 'load' 'store'> <Ports = 2> <Width = 24> <Depth = 4096> <RAM>
ST_3 : Operation 47 [1/1] (0.00ns)   --->   "%br_ln23 = br void %arrayidx1010.exit" [top.cpp:23]   --->   Operation 47 'br' 'br_ln23' <Predicate = (trunc_ln21_1 == 1)> <Delay = 0.00>
ST_3 : Operation 48 [1/1] ( I:1.35ns O:1.35ns )   --->   "%store_ln23 = store i24 %trunc_ln23, i12 %A_1_addr" [top.cpp:23]   --->   Operation 48 'store' 'store_ln23' <Predicate = (trunc_ln21_1 == 0)> <Delay = 1.35> <CoreInst = "RAM">   --->   Core 82 'RAM' <Latency = 1> <II = 1> <Delay = 1.35> <Storage> <Opcode : 'load' 'store'> <Ports = 2> <Width = 24> <Depth = 4096> <RAM>
ST_3 : Operation 49 [1/1] (0.00ns)   --->   "%br_ln23 = br void %arrayidx1010.exit" [top.cpp:23]   --->   Operation 49 'br' 'br_ln23' <Predicate = (trunc_ln21_1 == 0)> <Delay = 0.00>
ST_3 : Operation 50 [1/1] ( I:1.35ns O:1.35ns )   --->   "%store_ln23 = store i24 %trunc_ln23, i12 %A_3_addr" [top.cpp:23]   --->   Operation 50 'store' 'store_ln23' <Predicate = (trunc_ln21_1 == 3)> <Delay = 1.35> <CoreInst = "RAM">   --->   Core 82 'RAM' <Latency = 1> <II = 1> <Delay = 1.35> <Storage> <Opcode : 'load' 'store'> <Ports = 2> <Width = 24> <Depth = 4096> <RAM>
ST_3 : Operation 51 [1/1] (0.00ns)   --->   "%br_ln23 = br void %arrayidx1010.exit" [top.cpp:23]   --->   Operation 51 'br' 'br_ln23' <Predicate = (trunc_ln21_1 == 3)> <Delay = 0.00>
ST_3 : Operation 52 [1/1] (0.89ns)   --->   "%add_ln21 = add i7 %select_ln20, i7 1" [top.cpp:21]   --->   Operation 52 'add' 'add_ln21' <Predicate = true> <Delay = 0.89> <CoreInst = "Adder">   --->   Core 1 'Adder' <Latency = 0> <II = 1> <Delay = 0.89> <FuncUnit> <Opcode : 'add' 'sub'> <InPorts = 2> <OutPorts = 1>
ST_3 : Operation 53 [1/1] (0.48ns)   --->   "%store_ln20 = store i9 %select_ln20_1, i9 %i" [top.cpp:20]   --->   Operation 53 'store' 'store_ln20' <Predicate = true> <Delay = 0.48>
ST_3 : Operation 54 [1/1] (0.48ns)   --->   "%store_ln21 = store i7 %add_ln21, i7 %j" [top.cpp:21]   --->   Operation 54 'store' 'store_ln21' <Predicate = true> <Delay = 0.48>
ST_3 : Operation 55 [1/1] (0.00ns)   --->   "%br_ln21 = br void %for.inc" [top.cpp:21]   --->   Operation 55 'br' 'br_ln21' <Predicate = true> <Delay = 0.00>


============================================================
+ Verbose Summary: Timing violations
============================================================
Target clock period: 10.000ns, clock uncertainty: 2.700ns.

 <State 1>: 1.980ns
The critical path consists of the following:
	'store' operation 0 bit ('store_ln0') of constant 0 on local variable 'indvar_flatten' [13]  (0.489 ns)
	'load' operation 15 bit ('indvar_flatten_load', top.cpp:20) on local variable 'indvar_flatten' [18]  (0.000 ns)
	'icmp' operation 1 bit ('icmp_ln20', top.cpp:20) [20]  (1.002 ns)
	'store' operation 0 bit ('store_ln20', top.cpp:20) of variable 'add_ln20_1', top.cpp:20 on local variable 'indvar_flatten' [60]  (0.489 ns)

 <State 2>: 7.300ns
The critical path consists of the following:
	'getelementptr' operation 32 bit ('A_addr', top.cpp:20) [26]  (0.000 ns)
	bus read operation ('A_addr_read', top.cpp:23) on port 'A' (top.cpp:23) [43]  (7.300 ns)

 <State 3>: 3.294ns
The critical path consists of the following:
	'load' operation 7 bit ('j_load', top.cpp:21) on local variable 'j', top.cpp:21 [24]  (0.000 ns)
	'icmp' operation 1 bit ('icmp_ln21', top.cpp:21) [30]  (0.897 ns)
	'select' operation 7 bit ('select_ln20', top.cpp:20) [31]  (0.420 ns)
	'store' operation 0 bit ('store_ln23', top.cpp:23) of variable 'trunc_ln23', top.cpp:23 on array 'A_1' [53]  (1.352 ns)
	blocking operation 0.625 ns on control path)


============================================================
+ Verbose Summary: Binding
============================================================
N/A
* FSMD analyzer results:
  - Output states:
 - Input state : 
  - Chain level:
	State 1
	State 2
	State 3


============================================================
+ Verbose Summary: Datapath Resource usage 
============================================================
N/A
